ticker,company,sector,industry,agent1_packaging_need_score,document_type,form,filing_date,matched_term,signal_type,signal_score,snippet,source_url,total_lead_score
MOJO,EQUATOR Beverage Co,Consumer Defensive,Beverages - Non-Alcoholic,115,SEC filing,10-Q,2025-08-06,recycled content,recyclable_packaging_commitment,45," of third-party studies (whether or not scientifically valid); shifting consumer demographics; changes in consumer tastes and needs coupled with a rapid expansion of beverage options and delivery methods; changes in consumer lifestyles; concerns regarding the environmental, social and sustainability impact of ingredient sources and the product manufacturing process; consumer emphasis on transparency related to ingredients we use in our products and collection and recyclability of, and amount of recycled content contained in, our packaging containers and other materials; and competitive product and pricing pressures. In addition, in many of our markets, shopping patterns are being affected by the digital evolution, with consumers rapidly embracing shopping by way of mobile device applications, e-commerce retailers and e-commerce websites or platforms. If we fail to address changes in consumer product and shopping preferences, do not successfully anticipate and prepare for future changes in such prefere",https://www.sec.gov/Archives/edgar/data/1414953/000147793225005498/mojo_10q.htm,160
SBEV,"SPLASH BEVERAGE GROUP, INC.",Consumer Defensive,Beverages - Wineries & Distilleries,115,SEC filing,10-K,2026-04-15,packaging,packaging_redesign_signal,45,"ies C effective December 31, 2025. 3 Competition We compete with a large variety of other companies in the marketplace for the sale of alcoholic products. The beverage sector is highly competitive, and include international, national, regional and local producers and distributors. Competitive factors in the beverage industry include price and promotional activity, advertising and marketing programs, point-of-sale merchandising, retail space management, customer service, product differentiation, packaging innovations and distribution methods. Manufacturing and Co-packing Although we are responsible for manufacturing tequila products, we do not directly manufacture these products, but instead outsource such manufacturing to third party bottlers and contract packers and distillers. Chispo products are manufactured in Mexico, under contract manufacturing arrangements. These co-packaging arrangements are terminable upon request and do not obligate us to produce any minimum quantities of products wit",https://www.sec.gov/Archives/edgar/data/1553788/000173112226000577/e7552_10-k.htm,160
CENT,CENTRAL GARDEN & PET CO,Consumer Defensive,Packaged Foods,135,SEC filing,10-K,2025-11-26,plastic,general_packaging_signal,25,"® , and Zilla brands. Live Fish and Small Animals. Segrest and SunPet are leading wholesalers of aquarium fish and plants, reptiles and small animals serving pet specialty, mass merchants, aquariums and research institutions. Outdoor cushions. Arden-branded and private label outdoor cushions are sold across major retailers both in-store and online, using Arden's EverTru ® -branded outdoor fabric and OceanTex™ fabrics, the latter made from up to 100% recycled materials, including reclaimed ocean plastic and fishing nets. Pet Sales and Distribution Network Our U.S. sales and distribution network supports almost 10,000 retailer locations and over 5,600 veterinary offices, with services ranging from shelf placement and replenishment, to tailored retailer programs, product launches and exposure for acquired brands. By consolidating proprietary and third-party brands into single shipments, we help independent retailers operate more cost effectively. Pet Sales and Marketing Our sales strategy is des",https://www.sec.gov/Archives/edgar/data/887733/000088773325000041/cent-20250927.htm,160
HLF,HERBALIFE LTD.,Consumer Defensive,Packaged Foods,110,SEC filing,10-K,2026-02-18,recycled content,recyclable_packaging_commitment,50,"s and may damage our reputation. Companies across all industries are facing increasing scrutiny relating to their environmental, social, and governance practices from a number of different, and at times contrasting, perspectives. Consumers and investors may impose additional standards and expectations on companies in these areas. Changing consumer preferences and investor focus may result in increased demands regarding the source of origin of our ingredients, the recyclability of, and amount of recycled content contained in, our packaging containers, and other components of our products and supply chain and their respective environmental impact, including on sustainability. These consumer demands, along with regulatory requirements, remain inconsistent and exposes us to unpredictable reporting obligations or business requirements, could require additional transparency, due diligence, and reporting and could cause us to incur additional costs or to make changes to our operations to comply with such dem",https://www.sec.gov/Archives/edgar/data/1180262/000119312526057113/hlf-20251231.htm,160
GROV,"Grove Collaborative Holdings, Inc.",Consumer Defensive,Household & Personal Products,115,SEC filing,10-K,2026-03-05,packaging innovation,packaging_redesign_signal,45,"sed as incurred and consist primarily of our customer acquisition costs associated with online advertising, as well as advertising on television, direct mail campaigns and other media. Costs associated with the production of advertising are expensed when the first advertisement is shown. Product Development Product development expenses are related to the ongoing support and maintenance of our DTC platform, as well as amortization of capitalized, internally developed software and the product and packaging innovation in our Grove Brands products. Product development expenses consist primarily of personnel-related expenses, including salaries, bonuses, benefits and stock-based compensation expense. Product development costs also include allocated facilities, equipment, depreciation and overhead costs. Selling, General and Administrative Selling, general and administrative expenses consist primarily of compensation and benefit costs for personnel involved in general corporate functions, including stock-based ",https://www.sec.gov/Archives/edgar/data/1841761/000184176126000010/grov-20251231.htm,160
MOJO,EQUATOR Beverage Co,Consumer Defensive,Beverages - Non-Alcoholic,115,SEC filing,10-Q,2025-11-03,packaging waste,recyclable_packaging_commitment,45,"ganizations and other groups. If we fail to achieve or improperly report on our progress toward achieving our announced environmental goals and targets, the resulting negative publicity could adversely affect consumer preference for our products. In addition, in response to environmental concerns, governmental entities in the United States and in many other jurisdictions around the world have adopted, or are considering adopting, regulations and policies designed to mandate or encourage plastic packaging waste reduction and an increase in recycling rates and/or recycled content minimums, or, in some cases, restrict or even prohibit the use of certain plastic containers or packaging materials. These regulations and policies, whatever their scope or form, could increase the cost of our beverage products or otherwise put the Company at a competitive disadvantage. In addition, our increased focus on reducing plastic containers and other packaging materials waste has in the past and may continue to requir",https://www.sec.gov/Archives/edgar/data/1414953/000147793225007863/mojo_10q.htm,160
JBSS,SANFILIPPO JOHN B & SON INC,Consumer Defensive,Packaged Foods,120,SEC filing,10-Q,2026-01-29,packaging innovation,packaging_redesign_signal,40," brand names. Our products are sold through three core distribution channels, including food retailers in the consumer channel, commercial ingredient users and contract manufacturing customers. Our Long-Range Plan defines our future growth priorities, focused on accelerating our private brand business with key customers in high-growth snacking categories, most notably private brand bars, while expanding branded distribution behind Orchard Valley Harvest and Fisher via insight-driven product and packaging innovation. Execution of this plan is anchored in delivering value-added solutions and high-quality, innovative products based on our extensive industry and consumer expertise. Growth in private brand bars will be supported by capacity expansion and a robust innovation pipeline, with continued focus on nutrition bars. For our branded nut & trail mix business, we are focused on attracting new consumers through product innovation, broader distribution across traditional and alternative channels and expanded",https://www.sec.gov/Archives/edgar/data/880117/000119312526029438/jbss-20251225.htm,160
JBSS,SANFILIPPO JOHN B & SON INC,Consumer Defensive,Packaged Foods,120,SEC filing,10-Q,2026-04-29,packaging innovation,packaging_redesign_signal,40," brand names. Our products are sold through three core distribution channels, including food retailers in the consumer channel, commercial ingredient users and contract manufacturing customers. Our Long-Range Plan defines our future growth priorities, focused on accelerating our private brand business with key customers in high-growth snacking categories, most notably private brand bars, while expanding branded distribution behind Orchard Valley Harvest and Fisher via insight-driven product and packaging innovation. Execution of this plan is anchored in delivering value-added solutions and high-quality, innovative products based on our extensive industry and consumer expertise. Growth in private brand bars will be supported by capacity expansion and a robust innovation pipeline, with continued focus on nutrition bars. For our branded nut and trail mix business, we are focused on attracting new consumers through product innovation, broader distribution across traditional and alternative channels and expand",https://www.sec.gov/Archives/edgar/data/880117/000119312526191644/jbss-20260326.htm,160
MOJO,EQUATOR Beverage Co,Consumer Defensive,Beverages - Non-Alcoholic,115,SEC filing,10-Q,2025-11-03,recycled content,recyclable_packaging_commitment,45," of third-party studies (whether or not scientifically valid); shifting consumer demographics; changes in consumer tastes and needs coupled with a rapid expansion of beverage options and delivery methods; changes in consumer lifestyles; concerns regarding the environmental, social and sustainability impact of ingredient sources and the product manufacturing process; consumer emphasis on transparency related to ingredients we use in our products and collection and recyclability of, and amount of recycled content contained in, our packaging containers and other materials; and competitive product and pricing pressures. In addition, in many of our markets, shopping patterns are being affected by the digital evolution, with consumers rapidly embracing shopping by way of mobile device applications, e-commerce retailers and e-commerce websites or platforms. If we fail to address changes in consumer product and shopping preferences, do not successfully anticipate and prepare for future changes in such prefere",https://www.sec.gov/Archives/edgar/data/1414953/000147793225007863/mojo_10q.htm,160
MOJO,EQUATOR Beverage Co,Consumer Defensive,Beverages - Non-Alcoholic,115,SEC filing,10-Q,2025-11-03,plastic packaging,recyclable_packaging_commitment,45,"ental organizations and other groups. If we fail to achieve or improperly report on our progress toward achieving our announced environmental goals and targets, the resulting negative publicity could adversely affect consumer preference for our products. In addition, in response to environmental concerns, governmental entities in the United States and in many other jurisdictions around the world have adopted, or are considering adopting, regulations and policies designed to mandate or encourage plastic packaging waste reduction and an increase in recycling rates and/or recycled content minimums, or, in some cases, restrict or even prohibit the use of certain plastic containers or packaging materials. These regulations and policies, whatever their scope or form, could increase the cost of our beverage products or otherwise put the Company at a competitive disadvantage. In addition, our increased focus on reducing plastic containers and other packaging materials waste has in the past and may continue to ",https://www.sec.gov/Archives/edgar/data/1414953/000147793225007863/mojo_10q.htm,160
MOJO,EQUATOR Beverage Co,Consumer Defensive,Beverages - Non-Alcoholic,115,SEC filing,10-Q,2026-05-13,plastic,recyclable_packaging_commitment,45,"uct expectations and digital purchasing trends, or delays in executing digital transformation initiatives, could reduce market share, revenue growth, and overall financial performance. RISKS RELATED TO REGULATORY AND LEGAL MATTERS Packaging and Environmental Regulations Changes in laws governing beverage containers and packaging, including deposit schemes, recycling mandates, recycled content requirements, ecotaxes, product stewardship obligations, PFAS restrictions, and prohibitions on certain plastics, may increase costs and require modifications to manufacturing, packaging, or distribution. Widespread adoption of such measures could reduce net operating revenues and profitability. Labeling, Marketing, and Product Restrictions New or expanded labeling, warning, or marketing restrictions relating to health, environmental, or ingredient concerns may inhibit product sales. For example, requirements under California’s Proposition 65 or similar laws could necessitate warning labels, potentially ",https://www.sec.gov/Archives/edgar/data/1414953/000157587226000313/mojo001_10q.htm,160
MOJO,EQUATOR Beverage Co,Consumer Defensive,Beverages - Non-Alcoholic,115,SEC filing,10-Q,2026-05-13,recycled content,recyclable_packaging_commitment,45,"ions, and digital platforms is changing shopping behaviors. Failure to anticipate or respond effectively to evolving product expectations and digital purchasing trends, or delays in executing digital transformation initiatives, could reduce market share, revenue growth, and overall financial performance. RISKS RELATED TO REGULATORY AND LEGAL MATTERS Packaging and Environmental Regulations Changes in laws governing beverage containers and packaging, including deposit schemes, recycling mandates, recycled content requirements, ecotaxes, product stewardship obligations, PFAS restrictions, and prohibitions on certain plastics, may increase costs and require modifications to manufacturing, packaging, or distribution. Widespread adoption of such measures could reduce net operating revenues and profitability. Labeling, Marketing, and Product Restrictions New or expanded labeling, warning, or marketing restrictions relating to health, environmental, or ingredient concerns may inhibit product sales. For exampl",https://www.sec.gov/Archives/edgar/data/1414953/000157587226000313/mojo001_10q.htm,160
JBSS,SANFILIPPO JOHN B & SON INC,Consumer Defensive,Packaged Foods,120,SEC filing,10-Q,2025-10-29,packaging innovation,packaging_redesign_signal,40,"ited States. Our products are sold through three core distribution channels, including food retailers in the consumer channel, commercial ingredient users and contract manufacturing customers. Our Long-Range Plan defines our future growth priorities and focuses on growing our private brand business across key customers and high-growth snacking categories, notably private brand bars, as well as expanding branded distribution behind Orchard Valley Harvest and Fisher via insight-driven product and packaging innovation. We will execute our Long-Range Plan by providing our private brand customers with value-added solutions and high-quality, innovative products based on our extensive industry and consumer expertise. Accelerating our private brand bars business will require us to expand capacity and develop a robust innovation pipeline with continued focus on nutrition bars. We will grow the reach of our branded nut & trail mix business by targeting new consumers, emphasizing product innovation, expanding distri",https://www.sec.gov/Archives/edgar/data/880117/000119312525256406/jbss-20250925.htm,160
GROV,"Grove Collaborative Holdings, Inc.",Consumer Defensive,Household & Personal Products,115,SEC filing,10-Q,2026-05-07,packaging innovation,packaging_redesign_signal,40,"sed as incurred and consist primarily of our customer acquisition costs associated with online advertising, as well as advertising on television, direct mail campaigns and other media. Costs associated with the production of advertising are expensed when the first advertisement is shown. Product Development Product development expenses are related to the ongoing support and maintenance of our DTC platform, as well as amortization of capitalized, internally developed software and the product and packaging innovation in our Grove Brands products. Product development expenses consist primarily of personnel-related expenses, including salaries, bonuses, benefits and stock-based compensation expense. Product development costs also include allocated facilities, equipment, depreciation and overhead costs. Selling, General and Administrative Selling, general and administrative expenses consist primarily of compensation and benefit costs for personnel involved in general corporate functions, including stock-based ",https://www.sec.gov/Archives/edgar/data/1841761/000184176126000035/grov-20260331.htm,155
GROV,"Grove Collaborative Holdings, Inc.",Consumer Defensive,Household & Personal Products,115,SEC filing,10-Q,2025-11-13,packaging innovation,packaging_redesign_signal,40,"al and administrative expenses. Advertising Advertising costs are expensed as incurred and consist primarily of our customer acquisition costs associated with online advertising, as well as advertising on television, direct mail campaigns and other media. Costs associated with the production of advertising are expensed when the first advertisement is shown. Product Development Product development expenses are related to the ongoing support and maintenance of our DTC platform and the product and packaging innovation in our Grove Brands products. Product development expenses consist primarily of personnel-related expenses, including salaries, bonuses, benefits and stock-based compensation expense. Product development costs also include allocated facilities, equipment, depreciation and overhead costs. Selling, General and Administrative Selling, general and administrative expenses consist primarily of compensation and benefit costs for personnel involved in general corporate functions, including stock-based ",https://www.sec.gov/Archives/edgar/data/1841761/000184176125000048/grov-20250930.htm,155
SENEA,Seneca Foods Corp,Consumer Defensive,Packaged Foods,130,SEC filing,10-K,2025-06-12,packaging,general_packaging_signal,25,"ets,"" ""may"", ""can"" and variations thereof and similar expressions. Forward-looking statements are subject to known and unknown risks, uncertainties, and other important factors that could cause actual results to differ materially from those expressed. We believe important factors that could cause actual results to differ materially from our expectations include, but are not limited to, the following: o the effects of rising costs and availability of raw fruit and vegetables, steel, ingredients, packaging, other raw materials, distribution and labor; o crude oil prices and their impact on distribution, packaging and energy costs; o an overall labor shortage, ability to retain a sufficient seasonal workforce, lack of skilled labor, labor inflation or increased turnover impacting our ability to recruit and retain employees; o climate and weather affecting growing conditions and crop yields; o our ability to successfully implement sales price increases and cost saving measures to offset cost increa",https://www.sec.gov/Archives/edgar/data/88948/000143774925020197/senea20250331_10k.htm,155
WEST,Westrock Coffee Co,Consumer Defensive,Packaged Foods,130,SEC filing,10-K,2026-03-10,plastic,general_packaging_signal,25," price of green coffee may materially adversely affect our business and operating results. Fluctuations in other commodity prices and in the availability of certain of our ingredients and packaging materials could negatively affect our liquidity, gross margins and profitability. In addition to green coffee, our other commodity inputs are also exposed to the risk of cost fluctuations. These inputs include tea, spices, sugar, dairy and the materials used in our packaging, such as carton board and plastic. Although these commodities may be available from a number of sources, we have very little control over the factors that can influence the prices we pay, including economic and political conditions, foreign currency fluctuations, transportation and storage costs, export restrictions, weather conditions and global climate patterns, and natural disasters (including floods, droughts, frosts, earthquakes and hurricanes). In addition, some of our ingredients and packaging materials may only be avail",https://www.sec.gov/Archives/edgar/data/1806347/000110465926025932/west-20251231x10k.htm,155
CHD,CHURCH & DWIGHT CO INC /DE/,Consumer Defensive,Household & Personal Products,130,SEC filing,10-K,2026-02-12,plastic,general_packaging_signal,25,"f the general population and the emergence of Generation Z and Generation Alpha who have different spending, consumption and purchasing habits and are increasingly shifting to “private label” products and new nontraditional brands rather than maintaining allegiance to historical brands; evolving consumer concerns or perceptions regarding sustainability practices of manufacturers, including the environmental impacts of products and the sourcing and sustainability of, packaging materials, such as plastic 15 packaging, and their environmental impact; greenhouse gas emissions; waste disposal practices; a growing demand for natural or organic products and ingredients; changing consumer sentiment toward non-local products or sources among different demographic groups; evolving consumer concerns or perceptions regarding the effects of ingredients or substances present in certain consumer products; reduced brand loyalty; and concerns regarding human capital practices. We and many of our competitors h",https://www.sec.gov/Archives/edgar/data/313927/000119312526048139/chd-20251231.htm,155
SENEB,Seneca Foods Corp,Consumer Defensive,Packaged Foods,130,SEC filing,10-K,2025-06-12,packaging,general_packaging_signal,25,"ets,"" ""may"", ""can"" and variations thereof and similar expressions. Forward-looking statements are subject to known and unknown risks, uncertainties, and other important factors that could cause actual results to differ materially from those expressed. We believe important factors that could cause actual results to differ materially from our expectations include, but are not limited to, the following: o the effects of rising costs and availability of raw fruit and vegetables, steel, ingredients, packaging, other raw materials, distribution and labor; o crude oil prices and their impact on distribution, packaging and energy costs; o an overall labor shortage, ability to retain a sufficient seasonal workforce, lack of skilled labor, labor inflation or increased turnover impacting our ability to recruit and retain employees; o climate and weather affecting growing conditions and crop yields; o our ability to successfully implement sales price increases and cost saving measures to offset cost increa",https://www.sec.gov/Archives/edgar/data/88948/000143774925020197/senea20250331_10k.htm,155
USNA,USANA HEALTH SCIENCES INC,Consumer Defensive,Packaged Foods,130,SEC filing,10-K,2026-03-16,plastic,general_packaging_signal,25,"licies. If we are unable to meet our sustainability goals or evolving regulator, investor, industry or stakeholder expectations and standards, or if we are perceived to have not responded appropriately to the continuing concern for ESG issues, customers may choose to stop purchasing our products and our reputation, business or financial condition may be adversely affected. In particular, these constituencies are increasingly focusing on environmental issues, including climate change, water use, plastic waste, and other sustainability concerns. These factors could cause us to incur additional costs, to make changes to our operations to make additional commitments, set targets or establish additional goals and take actions to meet them, which could expose us to market, operational and execution costs or risk. In addition to environmental issues these constituencies are also focused on social and other governance issues, including matters such as, but not limited to, human capital and social iss",https://www.sec.gov/Archives/edgar/data/896264/000089626426000021/usna-20260103.htm,155
