ticker,company,sector,industry,agent1_packaging_need_score,document_type,form,filing_date,matched_term,signal_type,signal_score,snippet,source_url,total_lead_score
LSF,"Laird Superfood, Inc.",Consumer Defensive,Packaged Foods,85,SEC filing,10-K,2026-03-30,single-use plastic,plastic_reduction_pressure,55," all relevant stakeholders, including customers, employees, community, shareholders, and the broader environment. This philosophy of “Ohana” is particularly important to our founders, Laird Hamilton and Gabrielle Reece, and permeates through our culture. Laird Superfood is conscientious in its sourcing of raw materials, the carbon-benefits of facilitating natural alternatives, the impact of our operations on the environment and our community and providing products that discourage the culture of single-use plastics. 5 Table of Contents Our Products Our goal is to bring our clean, functional, and sustainability-conscious products into our customers’ daily lives, formulated with the goal of providing sustained energy and nutrition throughout the day. As part of our focus on these goals, our primary products include: (i) coffee creamers, (ii) coffee, tea, and hot chocolate products, (iii) hydration and beverage enhancing products, and (iv) snacks and other food items. Following the Navitas Acquisition, our ",https://www.sec.gov/Archives/edgar/data/1650696/000143774926010369/lsf20251231_10k.htm,140
MOJO,EQUATOR Beverage Co,Consumer Defensive,Beverages - Non-Alcoholic,115,SEC filing,10-K,2026-03-23,packaging,general_packaging_signal,25,"oduct contains naturally occurring vitamins B and C, has no preservatives, and offers a fresh, crisp coconut taste. The Company’s coconut water is plant-based, renewable, and suitable for vegan, kosher, paleo, keto, and low-carbohydrate diets. In addition to Coconut Water, the Company produces Coconut Water + Pineapple Juice, Coconut Water + Mango Juice, Organic Coconut Water, Sparkling Coconut Water Citrus, Energy Sparkling Blood Orange, and Energy Sparkling Pink Grapefruit. Sustainability and Packaging Sustainability is a core component of EQUATOR’s business strategy. The Company uses 100% recyclable, eco-friendly packaging designed to reduce environmental impact. EQUATOR’s products are plant-based and made from renewable resources, demonstrating its commitment to responsible practices and long-term environmental stewardship. CURRENT OPERATIONS Markets and Distribution EQUATOR Beverage Company distributes its products in North America, the Caribbean, and Bermuda through a combination of third",https://www.sec.gov/Archives/edgar/data/1414953/000147793226001536/mojo_10k.htm,140
LSF,"Laird Superfood, Inc.",Consumer Defensive,Packaged Foods,85,SEC filing,10-K,2026-03-30,plastic,plastic_reduction_pressure,55,"nt stakeholders, including customers, employees, community, shareholders, and the broader environment. This philosophy of “Ohana” is particularly important to our founders, Laird Hamilton and Gabrielle Reece, and permeates through our culture. Laird Superfood is conscientious in its sourcing of raw materials, the carbon-benefits of facilitating natural alternatives, the impact of our operations on the environment and our community and providing products that discourage the culture of single-use plastics. 5 Table of Contents Our Products Our goal is to bring our clean, functional, and sustainability-conscious products into our customers’ daily lives, formulated with the goal of providing sustained energy and nutrition throughout the day. As part of our focus on these goals, our primary products include: (i) coffee creamers, (ii) coffee, tea, and hot chocolate products, (iii) hydration and beverage enhancing products, and (iv) snacks and other food items. Following the Navitas Acquisition, our ",https://www.sec.gov/Archives/edgar/data/1650696/000143774926010369/lsf20251231_10k.htm,140
MAMA,"Mama's Creations, Inc.",Consumer Defensive,Packaged Foods,110,SEC filing,10-K,2026-04-14,packaging,general_packaging_signal,25,"mong our current customers and will help us attract new customers. Additionally, we continuously receive positive customer testimonials regarding the great taste and quality of our products. • Healthy and convenient. Our products are made only from high-quality natural ingredients and are simple to prepare. Virtually every product we offer is ready-to-serve within 10 minu tes, thereby providing quick and easy meal solutions for our customers. By including the sauce and utilizing a tray with our packaging, our products can be prepared quickly and easily. • Great value. We strive to provide our customers with great-tasting products using healthy ingredients at an affordable price, many of which are all-natural. Typical retail prices range from $7.99 to $9.99 per pound for freshly prepared products sold in delis or hot bars. We believe the sizes of our product offerings represent a great value for the price. • New products and innovation . Since our inception, we have continued to introduce new an",https://www.sec.gov/Archives/edgar/data/1520358/000162828026025068/mmmb-20260131.htm,135
NAII,NATURAL ALTERNATIVES INTERNATIONAL INC,Consumer Defensive,Packaged Foods,110,SEC filing,10-K,2025-09-23,packaging,general_packaging_signal,25,"al Our vision is to enrich the world through the best of nutrition. We are a leading formulator, manufacturer and marketer of nutritional supplements. Our comprehensive strategic partnerships with our customers allow us to offer a wide range of innovative nutritional products and services to such customers including: scientific research, clinical studies, proprietary ingredients, customer-specific nutritional product formulation, product testing and evaluation, marketing management and support, packaging and delivery system design, regulatory review, and international product registration assistance. As our primary business activity, we provide private-label contract manufacturing services to companies that market and distribute vitamins, minerals, herbal and other nutritional supplements, as well as other health care products, to consumers both within and outside the U.S. We also own a patent estate related to the raw material ingredient known as beta-alanine, which is primarily commercialized",https://www.sec.gov/Archives/edgar/data/787253/000143774925029731/naii20250630_10k.htm,135
BOF,BranchOut Food Inc.,Consumer Defensive,Packaged Foods,110,SEC filing,10-K,2026-03-31,packaging,general_packaging_signal,25," sourcing and fostering relationships with local agricultural communities. Government Regulation Our operations are subject to regulation by U.S. federal, state, and local authorities, as well as foreign regulatory agencies in the jurisdictions in which we operate. In the United States, we are regulated by the Food and Drug Administration (“FDA”) under the Federal Food, Drug, and Cosmetic Act, as amended by the Food Safety Modernization Act (“FSMA”), which governs the manufacturing, processing, packaging, labeling, storage, and safety of food products, including imported foods. FSMA emphasizes preventive food safety controls and enhanced oversight of foreign food facilities supplying the U.S. market. We maintain food safety and quality systems designed to comply with applicable FDA and FSMA requirements and monitors regulatory developments to support continued compliance. Our products are also subject to regulation by the United States Department of Agriculture (“USDA”) and U.S. Customs and Bor",https://www.sec.gov/Archives/edgar/data/1962481/000149315226014040/form10-k.htm,135
CELH,"Celsius Holdings, Inc.",Consumer Defensive,Beverages - Non-Alcoholic,115,SEC filing,10-Q,2026-05-07,packaging,general_packaging_signal,20,"37 • The impact of internal and external cyber-security threats and breaches, including risks arising from emerging artificial intelligence-enabled threats; • Our ability to comply with data privacy and personal data protection laws; • Our ability to effectively manage future growth; • The impact of global or regional catastrophic events on our operations and ability to grow; • The impact of any actions by the U.S. Food and Drug Administration regarding the manufacture, composition/ingredients, packaging, marketing/labeling, storage, transportation and/or distribution of our products, or any required or elective recall of our products from distribution; • The impact of any actions by any regulatory bodies on our advertising; • The impact of current and potential litigation matters, whether or not successful, on our brand, reputation, results of operations, and cash flows; • Our ability to effectively compete in the functional beverage product industry and the strength of such industry; • The im",https://www.sec.gov/Archives/edgar/data/1341766/000134176626000039/celh-20260331.htm,135
SBEV,"SPLASH BEVERAGE GROUP, INC.",Consumer Defensive,Beverages - Wineries & Distilleries,115,SEC filing,10-Q,2026-05-20,packaging,general_packaging_signal,20,"ncentives offered to the Company’s customers and their customers. Sales taxes and other similar taxes are excluded from revenue. 10 Splash Beverage Group, Inc. Notes to the Condensed Consolidated Financial Statements Note 2 – Summary of Significant Accounting Policies, continued Distribution expenses to transport our products, and warehousing expense after manufacture are accounted for in Other General and Administrative cost. Cost of Goods Sold Cost of goods sold include the costs of products, packaging, transportation, warehousing, and costs associated with valuation allowances for expired, damaged or impaired inventory. The cost of transportation from production site to other 3 rd party warehouses or customer is included in Other General and Administrative cost. Other General and Administrative Expenses Other General and Administrative expenses includes Amazon selling fees, cost associated with the outbound shipping and handling of finished goods, insurance cost, consulting cost, legal and a",https://www.sec.gov/Archives/edgar/data/1553788/000173112226000769/e7644_10q.htm,135
MOJO,EQUATOR Beverage Co,Consumer Defensive,Beverages - Non-Alcoholic,115,SEC filing,10-Q,2025-08-06,plastic,general_packaging_signal,20,"ould increase our costs and reduce demand for our products. We offer nonrefillable containers in the United States. Legal requirements have been enacted in various jurisdictions requiring that deposits or certain ecotaxes or fees be charged in connection with the sale, marketing and use of certain beverage containers. Other proposals relating to beverage container deposits, recycling, recycling content, tethered bottle caps, ecotax and/or product stewardship, or prohibitions on certain types of plastic products, packages and cups (including packaging containing PFAS) have been introduced and/or adopted in various jurisdictions, and we anticipate that similar legislation or regulations may be proposed in the future at federal, state and local levels, both in the United States and elsewhere. Consumers’ increased concerns and changing attitudes about solid waste streams and environmental responsibility and the related publicity could result in the adoption of additional such legislation or regul",https://www.sec.gov/Archives/edgar/data/1414953/000147793225005498/mojo_10q.htm,135
MOJO,EQUATOR Beverage Co,Consumer Defensive,Beverages - Non-Alcoholic,115,SEC filing,10-Q,2025-11-03,plastic,general_packaging_signal,20,"ould increase our costs and reduce demand for our products. We offer nonrefillable containers in the United States. Legal requirements have been enacted in various jurisdictions requiring that deposits or certain ecotaxes or fees be charged in connection with the sale, marketing and use of certain beverage containers. Other proposals relating to beverage container deposits, recycling, recycling content, tethered bottle caps, ecotax and/or product stewardship, or prohibitions on certain types of plastic products, packages and cups (including packaging containing PFAS) have been introduced and/or adopted in various jurisdictions, and we anticipate that similar legislation or regulations may be proposed in the future at federal, state and local levels, both in the United States and elsewhere. Consumers’ increased concerns and changing attitudes about solid waste streams and environmental responsibility and the related publicity could result in the adoption of additional such legislation or regul",https://www.sec.gov/Archives/edgar/data/1414953/000147793225007863/mojo_10q.htm,135
MOJO,EQUATOR Beverage Co,Consumer Defensive,Beverages - Non-Alcoholic,115,SEC filing,10-Q,2026-05-13,packaging,general_packaging_signal,20,"duct contains naturally occurring vitamins B and C, has no preservatives, and offers a fresh, crisp coconut taste. The Company’s coconut water is plant-based, renewable, and suitable for vegan, kosher, paleo, keto, and low-carbohydrate diets . In addition to Coconut Water, the Company produces Coconut Water + Pineapple Juice, Coconut Water + Mango Juice, Organic Coconut Water, Sparkling Coconut Water Citrus, Energy Sparkling Blood Orange, and Energy Sparkling Pink Grapefruit. Sustainability and Packaging Sustainability is a core component of EQUATOR’s business strategy. The Company uses 100% recyclable, eco-friendly packaging designed to reduce environmental impact. EQUATOR’s products are plant-based and made from renewable resources, demonstrating its commitment to responsible practices and long-term environmental stewardship. CURRENT OPERATIONS Markets and Distribution EQUATOR Beverage Company distributes its products in North America, the Caribbean, and Bermuda through a combination of third",https://www.sec.gov/Archives/edgar/data/1414953/000157587226000313/mojo001_10q.htm,135
GROV,"Grove Collaborative Holdings, Inc.",Consumer Defensive,Household & Personal Products,115,SEC filing,10-Q,2025-11-13,plastic,general_packaging_signal,20,"Grove Brands”) and third-parties. The Company has historically sold products through a retail channel in which the Company sold products from Grove-owned brands at wholesale. In third quarter of fiscal year 2024, the Company made the strategic decision to wind down sales through the retail channel. The Company develops and sells natural products that are free from the harmful chemicals identified in the Company’s “anti-ingredient” list and designs form factors and product packaging that reduces plastic waste and improves the environmental impact of the categories in which the Company operates. The Company also purchases environmental offsets that have made it the first plastic neutral retailer in the world. Grove Collaborative, Inc. (herein referred to as “Legacy Grove”), the Company’s accounting predecessor, was incorporated in Delaware in 2016. 2. Summary of Significant Accounting Policies Basis of Presentation and Liquidity The Company’s unaudited condensed consolidated financial statement",https://www.sec.gov/Archives/edgar/data/1841761/000184176125000048/grov-20250930.htm,135
GROV,"Grove Collaborative Holdings, Inc.",Consumer Defensive,Household & Personal Products,115,SEC filing,10-Q,2025-11-13,packaging,general_packaging_signal,20,"m Grove-owned brands (“Grove Brands”) and third-parties. The Company has historically sold products through a retail channel in which the Company sold products from Grove-owned brands at wholesale. In third quarter of fiscal year 2024, the Company made the strategic decision to wind down sales through the retail channel. The Company develops and sells natural products that are free from the harmful chemicals identified in the Company’s “anti-ingredient” list and designs form factors and product packaging that reduces plastic waste and improves the environmental impact of the categories in which the Company operates. The Company also purchases environmental offsets that have made it the first plastic neutral retailer in the world. Grove Collaborative, Inc. (herein referred to as “Legacy Grove”), the Company’s accounting predecessor, was incorporated in Delaware in 2016. 2. Summary of Significant Accounting Policies Basis of Presentation and Liquidity The Company’s unaudited condensed consolidate",https://www.sec.gov/Archives/edgar/data/1841761/000184176125000048/grov-20250930.htm,135
GROV,"Grove Collaborative Holdings, Inc.",Consumer Defensive,Household & Personal Products,115,SEC filing,10-Q,2026-05-07,plastic,general_packaging_signal,20," Company does not have any operations outside the United States. The Company sells its products primarily through a direct-to-consumer (“DTC”) platform at www.grove.co and the Company’s mobile applications, where the Company sells products from Grove-owned brands (“Grove Brands”) and third-parties. The Company develops and sells natural products that are free from the harmful chemicals identified in the Company’s “anti-ingredient” list and designs form factors and product packaging that reduces plastic waste and improves the environmental impact of the categories in which the Company operates. The Company also purchases environmental offsets that have made it the first plastic neutral retailer in the world. Grove Collaborative, Inc. (herein referred to as “Legacy Grove”), the Company’s accounting predecessor, was incorporated in Delaware in 2016. 2. Summary of Significant Accounting Policies Basis of Presentation and Liquidity The Company’s unaudited condensed consolidated financial statement",https://www.sec.gov/Archives/edgar/data/1841761/000184176126000035/grov-20260331.htm,135
GROV,"Grove Collaborative Holdings, Inc.",Consumer Defensive,Household & Personal Products,115,SEC filing,10-Q,2026-05-07,packaging,general_packaging_signal,20,"ncisco, California. The Company does not have any operations outside the United States. The Company sells its products primarily through a direct-to-consumer (“DTC”) platform at www.grove.co and the Company’s mobile applications, where the Company sells products from Grove-owned brands (“Grove Brands”) and third-parties. The Company develops and sells natural products that are free from the harmful chemicals identified in the Company’s “anti-ingredient” list and designs form factors and product packaging that reduces plastic waste and improves the environmental impact of the categories in which the Company operates. The Company also purchases environmental offsets that have made it the first plastic neutral retailer in the world. Grove Collaborative, Inc. (herein referred to as “Legacy Grove”), the Company’s accounting predecessor, was incorporated in Delaware in 2016. 2. Summary of Significant Accounting Policies Basis of Presentation and Liquidity The Company’s unaudited condensed consolidate",https://www.sec.gov/Archives/edgar/data/1841761/000184176126000035/grov-20260331.htm,135
CPB,CAMPBELL'S Co,Consumer Defensive,Packaged Foods,120,SEC filing,8-K,2025-12-09,packaging,general_packaging_signal,15," by, or on behalf of, us: • declines or volatility in financial markets, deteriorating economic conditions and other external factors, including the impact and application of new or changes to existing governmental laws, regulations, and policies; • the risks associated with imposed and threatened tariffs by the U.S. and reciprocal tariffs by its trading partners; • the risks related to the availability of, and cost inflation in, supply chain inputs, including labor, raw materials, commodities, packaging and transportation, including those related to tariffs; • disruptions in or inefficiencies to Campbell’s’ supply chain and/or operations, including reliance on key contract manufacturer and supplier relationships; • Campbell’s’ ability to execute on and realize the expected benefits from its strategy, including sales growth in and/or maintenance of our market share position in snacks, soups, sauces and beverages; • the impact of strong competitive responses to Campbell’s’ efforts to leverage it",https://www.sec.gov/Archives/edgar/data/16732/000119312525311905/d23938d8k.htm,135
PURE,"PURE BIOSCIENCE, INC.",Consumer Defensive,Household & Personal Products,110,SEC filing,10-K,2025-10-29,packaging,general_packaging_signal,25,"may have a material impact on our margins and our ability to supply our customers. All of the supply ingredients used to manufacture our SDC-based products are available from multiple suppliers. However, commodity prices for some ingredients can vary significantly and the margins that we are able to generate could decline if prices rise. For example, both silver and citric acid prices have been volatile in recent periods. In addition to such commodities, we also rely on producers of specialized packaging inputs such as bottles and labels for finished products. Due to their specialized nature, the supply of such inputs can be periodically constrained and result in additional costs to obtain these items, which may in turn inhibit our ability to supply products to our customers. We are generally unable to increase our product prices to our customers, partners and distributors quickly in order to maintain our margins, and significant price increases for key inputs could therefore have an adverse ef",https://www.sec.gov/Archives/edgar/data/1006028/000149315225020065/form10-k.htm,135
QSR,Restaurant Brands International Inc.,Consumer Cyclical,Restaurants,90,SEC filing,10-K,2026-02-20,extended producer responsibility,regulatory_pressure,45,"cused on social, governance, and environmental sustainability matters, such as climate change, greenhouse gases, packaging and waste, human rights, diversity, sustainable supply chain practices, animal health and welfare, deforestation, land, energy, and water use, and other corporate responsibility matters. We and our franchisees are and may become subject to changing rules, regulations, and consumer or investor expectations with respect to these matters and across different regions, including extended producer responsibility obligations that relate to our product packaging, reporting requirements under the European Union’s Corporate Sustainability Reporting Directive, and environmental representation standards and enforcement under Canada's amended Competition Act. As a result of these evolving requirements and expectations, we may continue to establish or expand goals, commitments, or targets, take actions to meet such goals, commitments, and targets, and provide expanded disclosure and substantiation on these mat",https://www.sec.gov/Archives/edgar/data/1618756/000161875626000017/qsr-20251231.htm,135
HLF,HERBALIFE LTD.,Consumer Defensive,Packaged Foods,110,SEC filing,10-K,2026-02-18,packaging,general_packaging_signal,25,"tructuring efforts, increased market penetration in existing markets, and personalized product and related technology initiatives); • the effectiveness and acceptance of new technology-driven initiatives; • any material disruption to our business caused by natural disasters, other catastrophic events, acts of war or terrorism, including the wars in Ukraine and the Middle East, cybersecurity incidents, pandemics, and/or other acts by third parties; • our ability to adequately source ingredients, packaging materials, and other raw materials and manufacture and distribute our products; • our reliance on our information technology infrastructure, and our ability to successfully develop, deploy, and integrate artificial intelligence into our business; • noncompliance by us or our Members with any privacy, artificial intelligence and data protection laws, rules, or regulations or any security breach involving the misappropriation, loss, or other unauthorized use or disclosure of confidential informat",https://www.sec.gov/Archives/edgar/data/1180262/000119312526057113/hlf-20251231.htm,135
MAMA,"Mama's Creations, Inc.",Consumer Defensive,Packaged Foods,110,SEC filing,10-K,2026-04-14,plastic,general_packaging_signal,25,"g, or other food or safety matters, or new interpretations or enforcement of existing laws and regulations, as well as any related litigation, may have a material adverse effect on our sales and profitability. Increases in the cost and restrictions on the availability of raw materials could adversely affect our financial results. Our products include agricultural commodities such as tomatoes, onions, poultry, meats and other items such as spices and flour, as well as packaging materials such as plastic, metal, paper, fiberboard, and other materials and inputs such as water, in order to manufacture products. The availability or cost of such commodities may fluctuate widely due to government policy and regulation, crop failures or shortages due to plant disease or insect and other pest infestation, weather conditions, potential impact of climate change, increased demand for biofuels, or other unforeseen circumstances. To the extent that any of the foregoing or other unknown factors increase the",https://www.sec.gov/Archives/edgar/data/1520358/000162828026025068/mmmb-20260131.htm,135
