ticker,company,sector,industry,agent1_packaging_need_score,document_type,form,filing_date,matched_term,signal_type,signal_score,snippet,source_url,total_lead_score
KPEA,Kun Peng International Ltd.,Consumer Cyclical,Internet Retail,155,SEC filing,10-K,2025-12-31,plastic,plastic_reduction_pressure,55,"any. Environment. As part of our Company’s environmental strategy, we work to mitigate our carbon footprint by carefully considering how we consume resources and integrating the best environmentally-focused technology into our business. Our Company has been implementing the concept of environmental protection by utilizing capital resources for enhancing product quality, reviewing the practices of manufacturers, including the sourcing and sustainability of packaging materials, such as single-use plastics, identifying a growing demand for natural or organic products and ingredients, understanding evolving consumer concerns regarding the effects of ingredients or substances present in products, attempting to change consumer sentiment toward non-local products or sources, and attempting to increase awareness of environmental impacts (including packaging, energy and water use, and waste management). Our Company has started utilizing a sustainable environmental protection packaging, the newly desig",https://www.sec.gov/Archives/edgar/data/1502557/000149315225029689/form10-k.htm,210
KPEA,Kun Peng International Ltd.,Consumer Cyclical,Internet Retail,155,SEC filing,10-K,2025-12-31,single-use plastic,plastic_reduction_pressure,55,"or the Company. Environment. As part of our Company’s environmental strategy, we work to mitigate our carbon footprint by carefully considering how we consume resources and integrating the best environmentally-focused technology into our business. Our Company has been implementing the concept of environmental protection by utilizing capital resources for enhancing product quality, reviewing the practices of manufacturers, including the sourcing and sustainability of packaging materials, such as single-use plastics, identifying a growing demand for natural or organic products and ingredients, understanding evolving consumer concerns regarding the effects of ingredients or substances present in products, attempting to change consumer sentiment toward non-local products or sources, and attempting to increase awareness of environmental impacts (including packaging, energy and water use, and waste management). Our Company has started utilizing a sustainable environmental protection packaging, the newly desig",https://www.sec.gov/Archives/edgar/data/1502557/000149315225029689/form10-k.htm,210
NGVC,"Natural Grocers by Vitamin Cottage, Inc.",Consumer Defensive,Grocery Stores,160,SEC filing,10-K,2025-12-11,recycled content,recyclable_packaging_commitment,50,"n the part of consumers in the truthfulness of our labeling or ingredient claims. Environmental and Green Claims . The FTC has promulgated a guidance document referred to as the “Green Guides” that, while non-binding, expresses its view that marketing claims of general environmental benefits are potentially misleading; that any environmental benefits claim should be properly limited and qualified; and that consumer product packaging bearing specified environmental claims, such as “recyclable,” “recycled content,” “biodegradable” and “compostable,” should meet defined standards, so as not to be misleading. There has been a substantial rise in the number of consumer class action lawsuits against businesses making environmental claims. Should we be the subject of a consumer class action alleging that any environmental claims that appear on the product packaging we sell, such claims may adversely affect our reputation and brand value, expose us to claims for significant damages as well as attorneys’ fees ",https://www.sec.gov/Archives/edgar/data/1547459/000143774925037556/ngvc20250930_10k.htm,210
KPEA,Kun Peng International Ltd.,Consumer Cyclical,Internet Retail,155,SEC filing,10-K,2025-12-31,packaging,plastic_reduction_pressure,55,"t of its strategy and goals for the Company. Environment. As part of our Company’s environmental strategy, we work to mitigate our carbon footprint by carefully considering how we consume resources and integrating the best environmentally-focused technology into our business. Our Company has been implementing the concept of environmental protection by utilizing capital resources for enhancing product quality, reviewing the practices of manufacturers, including the sourcing and sustainability of packaging materials, such as single-use plastics, identifying a growing demand for natural or organic products and ingredients, understanding evolving consumer concerns regarding the effects of ingredients or substances present in products, attempting to change consumer sentiment toward non-local products or sources, and attempting to increase awareness of environmental impacts (including packaging, energy and water use, and waste management). Our Company has started utilizing a sustainable environmental",https://www.sec.gov/Archives/edgar/data/1502557/000149315225029689/form10-k.htm,210
CENTA,CENTRAL GARDEN & PET CO,Consumer Defensive,Packaged Foods,135,SEC filing,10-K,2025-11-26,extended producer responsibility,plastic_reduction_pressure,55,"rties or pay for associated clean-up costs, often extending liability to parties that did not cause the contamination. Over the course of our extensive acquisition history, we have obtained a number of manufacturing and distribution facilities, most of which have not undergone Phase II environmental testing to determine whether contamination is present. Packaging is facing heightened scrutiny from state governments. Multiple states are advancing laws to curb single-use plastics and to implement extended producer responsibility (EPR) programs—frameworks that shift the cost of packaging disposal from municipalities to manufacturers to strengthen the recycling ecosystem. These EPR programs commonly set targets and require reporting on areas such as post-consumer recycled content usage, compostable packaging, overall material reduction, and refill strategies. Corporate Sustainability The long-term success of our business depends on protecting the planet, supporting the communities we serve, and providing our employees wi",https://www.sec.gov/Archives/edgar/data/887733/000088773325000041/cent-20250927.htm,190
CENT,CENTRAL GARDEN & PET CO,Consumer Defensive,Packaged Foods,135,SEC filing,10-K,2025-11-26,compostable packaging,plastic_reduction_pressure,55,"mental testing to determine whether contamination is present. Packaging is facing heightened scrutiny from state governments. Multiple states are advancing laws to curb single-use plastics and to implement extended producer responsibility (EPR) programs—frameworks that shift the cost of packaging disposal from municipalities to manufacturers to strengthen the recycling ecosystem. These EPR programs commonly set targets and require reporting on areas such as post-consumer recycled content usage, compostable packaging, overall material reduction, and refill strategies. Corporate Sustainability The long-term success of our business depends on protecting the planet, supporting the communities we serve, and providing our employees with a safe, healthy and rewarding workplace. Corporate sustainability is embedded in our long-term enterprise roadmap and brought to life through our Central Impact strategy. Our 2022-2023 Impact Report details our commitment and progress in protecting the planet, cultivating communi",https://www.sec.gov/Archives/edgar/data/887733/000088773325000041/cent-20250927.htm,190
CENTA,CENTRAL GARDEN & PET CO,Consumer Defensive,Packaged Foods,135,SEC filing,10-K,2025-11-26,recycled content,plastic_reduction_pressure,55,"dergone Phase II environmental testing to determine whether contamination is present. Packaging is facing heightened scrutiny from state governments. Multiple states are advancing laws to curb single-use plastics and to implement extended producer responsibility (EPR) programs—frameworks that shift the cost of packaging disposal from municipalities to manufacturers to strengthen the recycling ecosystem. These EPR programs commonly set targets and require reporting on areas such as post-consumer recycled content usage, compostable packaging, overall material reduction, and refill strategies. Corporate Sustainability The long-term success of our business depends on protecting the planet, supporting the communities we serve, and providing our employees with a safe, healthy and rewarding workplace. Corporate sustainability is embedded in our long-term enterprise roadmap and brought to life through our Central Impact strategy. Our 2022-2023 Impact Report details our commitment and progress in protecting th",https://www.sec.gov/Archives/edgar/data/887733/000088773325000041/cent-20250927.htm,190
CENTA,CENTRAL GARDEN & PET CO,Consumer Defensive,Packaged Foods,135,SEC filing,10-K,2025-11-26,single-use plastic,plastic_reduction_pressure,55,"tions to remediate contaminated properties or pay for associated clean-up costs, often extending liability to parties that did not cause the contamination. Over the course of our extensive acquisition history, we have obtained a number of manufacturing and distribution facilities, most of which have not undergone Phase II environmental testing to determine whether contamination is present. Packaging is facing heightened scrutiny from state governments. Multiple states are advancing laws to curb single-use plastics and to implement extended producer responsibility (EPR) programs—frameworks that shift the cost of packaging disposal from municipalities to manufacturers to strengthen the recycling ecosystem. These EPR programs commonly set targets and require reporting on areas such as post-consumer recycled content usage, compostable packaging, overall material reduction, and refill strategies. Corporate Sustainability The long-term success of our business depends on protecting the planet, supporting the c",https://www.sec.gov/Archives/edgar/data/887733/000088773325000041/cent-20250927.htm,190
COKE,"Coca-Cola Consolidated, Inc.",Consumer Defensive,Beverages - Non-Alcoholic,135,SEC filing,10-K,2026-02-18,recycled content,plastic_reduction_pressure,55,"are used in its business, implement new 10 recycling regulations and the reduction of single-use plastics and place the onus on plastic suppliers to identify recycling solutions. The Company is not currently impacted by the policies in such legislation, but it is possible that similar or more restrictive legal requirements may be proposed or enacted within its distribution territories in the future which could adversely impact bottle/can sales. Additionally, legislative priorities for increased recycled content in packaging could adversely impact our margins due to increased demand for such materials. It is also possible that the Company could be a named party in a lawsuit related to the environmental impact of plastics or littering. Any such lawsuit could subject us to liability or damage the reputation of the Company, which could adversely affect the Company’s profitability. Concerns about perceived negative safety and quality consequences of certain ingredients in the Company’s products, such as no",https://www.sec.gov/Archives/edgar/data/317540/000162828026009057/coke-20251231.htm,190
CENTA,CENTRAL GARDEN & PET CO,Consumer Defensive,Packaged Foods,135,SEC filing,10-K,2025-11-26,compostable packaging,plastic_reduction_pressure,55,"mental testing to determine whether contamination is present. Packaging is facing heightened scrutiny from state governments. Multiple states are advancing laws to curb single-use plastics and to implement extended producer responsibility (EPR) programs—frameworks that shift the cost of packaging disposal from municipalities to manufacturers to strengthen the recycling ecosystem. These EPR programs commonly set targets and require reporting on areas such as post-consumer recycled content usage, compostable packaging, overall material reduction, and refill strategies. Corporate Sustainability The long-term success of our business depends on protecting the planet, supporting the communities we serve, and providing our employees with a safe, healthy and rewarding workplace. Corporate sustainability is embedded in our long-term enterprise roadmap and brought to life through our Central Impact strategy. Our 2022-2023 Impact Report details our commitment and progress in protecting the planet, cultivating communi",https://www.sec.gov/Archives/edgar/data/887733/000088773325000041/cent-20250927.htm,190
CENT,CENTRAL GARDEN & PET CO,Consumer Defensive,Packaged Foods,135,SEC filing,10-K,2025-11-26,recycled content,plastic_reduction_pressure,55,"dergone Phase II environmental testing to determine whether contamination is present. Packaging is facing heightened scrutiny from state governments. Multiple states are advancing laws to curb single-use plastics and to implement extended producer responsibility (EPR) programs—frameworks that shift the cost of packaging disposal from municipalities to manufacturers to strengthen the recycling ecosystem. These EPR programs commonly set targets and require reporting on areas such as post-consumer recycled content usage, compostable packaging, overall material reduction, and refill strategies. Corporate Sustainability The long-term success of our business depends on protecting the planet, supporting the communities we serve, and providing our employees with a safe, healthy and rewarding workplace. Corporate sustainability is embedded in our long-term enterprise roadmap and brought to life through our Central Impact strategy. Our 2022-2023 Impact Report details our commitment and progress in protecting th",https://www.sec.gov/Archives/edgar/data/887733/000088773325000041/cent-20250927.htm,190
CENT,CENTRAL GARDEN & PET CO,Consumer Defensive,Packaged Foods,135,SEC filing,10-K,2025-11-26,single-use plastic,plastic_reduction_pressure,55,"tions to remediate contaminated properties or pay for associated clean-up costs, often extending liability to parties that did not cause the contamination. Over the course of our extensive acquisition history, we have obtained a number of manufacturing and distribution facilities, most of which have not undergone Phase II environmental testing to determine whether contamination is present. Packaging is facing heightened scrutiny from state governments. Multiple states are advancing laws to curb single-use plastics and to implement extended producer responsibility (EPR) programs—frameworks that shift the cost of packaging disposal from municipalities to manufacturers to strengthen the recycling ecosystem. These EPR programs commonly set targets and require reporting on areas such as post-consumer recycled content usage, compostable packaging, overall material reduction, and refill strategies. Corporate Sustainability The long-term success of our business depends on protecting the planet, supporting the c",https://www.sec.gov/Archives/edgar/data/887733/000088773325000041/cent-20250927.htm,190
CENT,CENTRAL GARDEN & PET CO,Consumer Defensive,Packaged Foods,135,SEC filing,10-K,2025-11-26,extended producer responsibility,plastic_reduction_pressure,55,"rties or pay for associated clean-up costs, often extending liability to parties that did not cause the contamination. Over the course of our extensive acquisition history, we have obtained a number of manufacturing and distribution facilities, most of which have not undergone Phase II environmental testing to determine whether contamination is present. Packaging is facing heightened scrutiny from state governments. Multiple states are advancing laws to curb single-use plastics and to implement extended producer responsibility (EPR) programs—frameworks that shift the cost of packaging disposal from municipalities to manufacturers to strengthen the recycling ecosystem. These EPR programs commonly set targets and require reporting on areas such as post-consumer recycled content usage, compostable packaging, overall material reduction, and refill strategies. Corporate Sustainability The long-term success of our business depends on protecting the planet, supporting the communities we serve, and providing our employees wi",https://www.sec.gov/Archives/edgar/data/887733/000088773325000041/cent-20250927.htm,190
COKE,"Coca-Cola Consolidated, Inc.",Consumer Defensive,Beverages - Non-Alcoholic,135,SEC filing,10-K,2026-02-18,single-use plastic,plastic_reduction_pressure,55," has been proposed in Congress and by certain state and local governments which would prohibit the sale of soft drink products in non-refillable bottles and cans or require a mandatory deposit as a means of encouraging the return of such containers, each in an attempt to reduce solid waste and litter. Similarly, we are aware of certain legislation that will impose fees or taxes on various types of containers that are used in our business, implement new recycling regulations and the reduction of single-use plastics and place the onus on plastic suppliers to identify or share the financial burden of recycling solutions. We are not currently impacted by the policies in such legislation, but it is possible that similar or more restrictive legal requirements may be proposed or enacted within our distribution territories in the future. We are also subject to federal, state and local environmental laws, including laws related to water consumption and treatment, wastewater discharge and air emissions. Our facil",https://www.sec.gov/Archives/edgar/data/317540/000162828026009057/coke-20251231.htm,190
JJSF,J&J SNACK FOODS CORP,Consumer Defensive,Packaged Foods,160,SEC filing,10-K,2025-11-26,packaging,general_packaging_signal,25,"ines. The Company’s DIPPIN’ DOTS’ frozen novelty products are cryogenically frozen beads, created using liquid nitrogen at -320 degrees Fahrenheit. Product variations include ice cream (milk and cream based), flavored ice (water based) and frozen yogurt branded YODOTS. The product is served to consumers by the cup, or via individual serving packages. The balance of the Company’s frozen novelties products are manufactured from water, sweeteners and fruit juice concentrates in various flavors and packaging including cups, tubes, and sticks. Several of the products contain ice cream and WHOLE FRUIT bars contains real fruit. Churros The Company’s churros are sold primarily under the ¡HOLA! brand name. Churros are sold to the Food Service and Retail Supermarkets segments. Churro sales were 6% of the Company’s sales in fiscal year 2025, 7% in fiscal year 2024, and 7% in fiscal year 2023. Churros are pastries in stick form which the Company produces in several sizes according to a proprietary formula.",https://www.sec.gov/Archives/edgar/data/785956/000143774925036456/jjsf20250927_10k.htm,185
NGVC,"Natural Grocers by Vitamin Cottage, Inc.",Consumer Defensive,Grocery Stores,160,SEC filing,10-K,2025-12-11,packaging,general_packaging_signal,25,"he NHC is responsible for training our store Crew members and educating our customers in accordance with applicable local, state and federal regulations. Each NHC must have earned a degree or certificate in nutrition or a related field from an accredited school, complete continuing education in nutrition and be thoroughly committed to fulfilling our mission. Substantially all of our NHCs are full-time Crew members. The NHCs are overseen by Regional Nutritional Health Coach Managers. Bulk Food Repackaging Facility and Distribution Center. We lease a 150,000 square foot bulk food repackaging facility and distribution center located in Golden, Colorado. That facility also houses a training center and certain administrative support functions. Inventory. We use a robust merchandise management and perpetual inventory system that values goods at moving average cost. We manage most shelf stock based on weeks-on-hand relative to sales, resupply time and minimum economic order quantity. Sourcing and Supp",https://www.sec.gov/Archives/edgar/data/1547459/000143774925037556/ngvc20250930_10k.htm,185
KO,COCA COLA CO,Consumer Defensive,Beverages - Non-Alcoholic,135,SEC filing,10-K,2026-02-20,recycled content,recyclable_packaging_commitment,50,"valid); shifting consumer demographics; changes in consumer tastes and needs coupled with a rapid expansion of beverage options and delivery methods; affordability and changes in consumer lifestyles and spending patterns; concerns regarding the environmental, social and sustainability impact of ingredient sources, the product manufacturing process and our packaging; consumer emphasis on transparency related to ingredients we use in our products and collection and recyclability of, and amount of recycled content contained in, our packaging containers and other materials; concerns about the health and welfare of animals in our dairy supply chain; and competitive product and pricing pressures. In addition, in many of our markets, shopping patterns are being affected by the digital evolution, with consumers rapidly embracing shopping by way of mobile device applications, e-commerce retailers and e-commerce websites or platforms. The increasing use of data analytics, automation and artificial intelligence ",https://www.sec.gov/Archives/edgar/data/21344/000162828026010047/ko-20251231.htm,185
KO,COCA COLA CO,Consumer Defensive,Beverages - Non-Alcoholic,135,SEC filing,10-K,2026-02-20,packaging waste,recyclable_packaging_commitment,50,"sulting negative publicity could adversely affect consumer preference for our products. In addition, tariffs and trade policies may impact the availability and cost of alternative packaging materials, leading us to rely more on plastic packaging than desired. In response to environmental concerns, governmental entities in the United States and in many other jurisdictions around the world have adopted, or are considering adopting, regulations and policies designed to mandate or encourage plastic packaging waste reduction and an increase in recycling rates and/or recycled content minimums, or, in some cases, restrict or even prohibit the use of certain plastic containers or packaging materials. These regulations and policies, whatever their scope or form, could increase the cost of our beverage products or otherwise put the Company at a competitive disadvantage. In addition, our increased focus on reducing plastic container waste and other packaging materials waste has in the past and may continue to r",https://www.sec.gov/Archives/edgar/data/21344/000162828026010047/ko-20251231.htm,185
KO,COCA COLA CO,Consumer Defensive,Beverages - Non-Alcoholic,135,SEC filing,10-K,2026-02-20,plastic packaging,recyclable_packaging_commitment,50,"nsored by nongovernmental organizations and other groups. If we and our bottling partners fail to achieve or improperly report on our progress toward achieving our announced environmental goals, or revise our goals, and/or discontinue our environmental initiatives, the resulting negative publicity could adversely affect consumer preference for our products. In addition, tariffs and trade policies may impact the availability and cost of alternative packaging materials, leading us to rely more on plastic packaging than desired. In response to environmental concerns, governmental entities in the United States and in many other jurisdictions around the world have adopted, or are considering adopting, regulations and policies designed to mandate or encourage plastic packaging waste reduction and an increase in recycling rates and/or recycled content minimums, or, in some cases, restrict or even prohibit the use of certain plastic containers or packaging materials. These regulations and policies, whatever th",https://www.sec.gov/Archives/edgar/data/21344/000162828026010047/ko-20251231.htm,185
NGVC,"Natural Grocers by Vitamin Cottage, Inc.",Consumer Defensive,Grocery Stores,160,SEC filing,10-K,2025-12-11,plastic,general_packaging_signal,25," our new store opening costs. Commitment to sustainable products and practices . We have put in place product standards for dairy, eggs, meat, seafood and produce that support sustainable and ecologically responsible production methods. We believe our standards help to enhance the health of our customers, promote animal welfare, reduce antibiotic resistance and protect the environment. We have also instituted measures to reduce food waste, divert usable products to food banks, reduce single use plastic bags and reduce the use of pesticides and antimicrobial products. We believe these efforts reflect our commitment to corporate social responsibility and demonstrate our support for sustainable regenerative agricultural practices. Experienced and committed management team with proven track record. Our executive management team has an average of 40 years of experience in the natural grocery industry, while our entire management team has an average of 33 years of relevant experience. Since the sec",https://www.sec.gov/Archives/edgar/data/1547459/000143774925037556/ngvc20250930_10k.htm,185
