ticker,company,sector,industry,agent1_packaging_need_score,document_type,form,filing_date,matched_term,signal_type,signal_score,snippet,source_url,total_lead_score
INBP,INTEGRATED BIOPHARMA INC,Consumer Defensive,Packaged Foods,95,SEC filing,10-Q,2026-05-08,packaging,general_packaging_signal,20,"ks and other sales allowances are reasonably determinable, and when collectability is reasonably assured. Accruals for these items are presented in the condensed consolidated financial statements as reductions to sales. The Company’s net sales represent gross sales invoiced to customers, less certain related charges for discounts, returns, rebates, charge-backs and other allowances. Cost of sales includes the cost of raw materials and all labor and overhead associated with the manufacturing and packaging of the products. Gross margins are affected by, among other things, changes in the relative sales mix among our products and valuation and/or charge off of slow moving, expired or obsolete inventories. The Company also recognizes revenue for warehousing and fulfillment services provided to MDCWHD customers. To perform revenue recognition for arrangements within the scope of ASC 606, the Company performs the following five steps: ● identification of the promised goods or services in the contract",https://www.sec.gov/Archives/edgar/data/1016504/000143774926015899/inbp20260331_10q.htm,115
DBGI,"Digital Brands Group, Inc.",Consumer Cyclical,Apparel Retail,95,SEC filing,10-Q,2026-05-20,packaging,general_packaging_signal,20,"ve expenses consist primarily of all payroll and payroll-related expenses, professional fees, insurance, software     costs, occupancy expenses related to Bailey’s operations at its headquarters, including utilities, depreciation and amortization,     and other costs related to the administration of its business. Bailey’s     fulfillment and shipping expenses include the cost to operate its warehouse including occupancy and labor costs to pick and pack     customer orders and any return orders; packaging; and shipping costs to the customer from the warehouse and any returns from the     customer to the warehouse. ● Sales     & Marketing. Bailey’s sales and marketing expense primarily includes digital advertising; photo shoots for wholesale     and direct-to-consumer communications, including email, social media and digital advertisements; and commission expenses associated     with sales representatives. ● Interest     Expense. Bailey’s interest expense consists primarily of interest related to",https://www.sec.gov/Archives/edgar/data/1668010/000149315226024610/form10-q.htm,115
INBP,INTEGRATED BIOPHARMA INC,Consumer Defensive,Packaged Foods,95,SEC filing,10-Q,2026-02-11,packaging,general_packaging_signal,20,"charge-backs and other sales allowances are reasonably determinable, and when collectability is reasonably assured. Accruals for these items are presented in the consolidated financial statements as reductions to sales. The Company’s net sales represent gross sales invoiced to customers, less certain related charges for discounts, returns, rebates, charge-backs and other allowances. Cost of sales includes the cost of raw materials and all labor and overhead associated with the manufacturing and packaging of the products. Gross margins are affected by, among other things, changes in the relative sales mix among our products and valuation and/or charge off of slow moving, expired or obsolete inventories. The Company also recognizes revenue for warehousing and fulfillment services provided to MDCWH customers. To perform revenue recognition for arrangements within the scope of ASC 606, the Company performs the following five steps: ● identification of the promised goods or services in the contract;",https://www.sec.gov/Archives/edgar/data/1016504/000143774926003803/inbp20251231_10q.htm,115
GLUC,"Glucose Health, Inc.",Consumer Defensive,Packaged Foods,95,SEC filing,10-Q,2016-05-23,packaging,general_packaging_signal,20,"tional and regional pharmacy retailers. To assist in achieving our final product objectives, we retained a former head of beverage product development at Nestle. We retained an attorney specializing in compliance with Food and Drug Administration (FDA) regulations, necessary, in part, to allow our product to be stocked by national pharmacy retailers. We also undertook a number of actions to establish and build our Glucose Health Ò brand. The Company conducted a design competition related to its packaging artwork and product logo and retained an experienced product packaging graphic artist to assist with all digital and print representations of the product. The Company filed for and received trademark protection for Glucose Health Ò with the United States Trademark and Patent Office (USPTO). While our primary sales and marketing focus is achieving sales to consumers through national and regional pharmacies, secondarily, we intend to also market the product directly to customers via our dedicated",https://www.sec.gov/Archives/edgar/data/1420108/000147793216010562/gluc_10q.htm,115
BDL,FLANIGANS ENTERPRISES INC,Consumer Cyclical,Restaurants,90,SEC filing,10-K,2025-12-19,packaging,general_packaging_signal,25,"ervation – We donate to fishing tournaments and beach cleanup                                             projects. ● Supporting                                             the local community – We donate funds to boy scouts, baseball teams, schools, etc. ● Reclaimed                                             Wood – All of our locations use reclaimed wood on interior walls. We also believe our sustainability programs and initiatives like restaurant-based recycling and replacing our off-premise packaging with materials that reduce the use of plastics and improve recyclability serve to foster pride in our staff. Executive Officers Name Positions     and Offices Currently Held Age Office     or Position Held Since James G. Flanigan Chairman of the Board of Directors, Chief Executive     Officer and President 61 (1) August Bucci Chief Operating Officer and Executive Vice President 81 2002 Jeffrey D. Kastner Chief Financial Officer, General Counsel and Secretary 72 (2) Christopher O’Neil Vice Presi",https://www.sec.gov/Archives/edgar/data/12040/000117494725001463/ea0268707-10k_flanigans.htm,115
CMG,CHIPOTLE MEXICAN GRILL INC,Consumer Cyclical,Restaurants,90,SEC filing,10-K,2026-02-04,plastic,general_packaging_signal,25,"ur delivery and catering businesses, in which our food is transported, stored and/or served in conditions that are not under our control. All of these factors could have an adverse impact on our ability to attract and retain guests, which could in turn have a material adverse effect on our growth and profitability. In addition, real or perceived concerns about pervasive chemicals and substances in the U.S. food supply chain, such as phthalates, per- and polyfluoroalkyl substances (""PFAS""), microplastics or heavy metals, have been the subject of increased regulatory scrutiny and lawsuits against us and other restaurant companies, which could impact consumers’ confidence in the restaurant industry and reduce restaurant sales. Failure to maintain the value and reputation of the Chipotle brand could negatively impact our financial results . We built strong value in the Chipotle brand by serving delicious, high quality food, made fresh every day using responsibly sourced ingredients served in gene",https://www.sec.gov/Archives/edgar/data/1058090/000105809026000009/cmg-20251231.htm,115
IPAR,INTERPARFUMS INC,Consumer Defensive,Household & Personal Products,90,SEC filing,10-K,2026-03-10,packaging,general_packaging_signal,25,"ne extensions""). The creation and marketing of each product family are intimately linked with the brand’s name, its past and present positioning, customer base and, more generally, the prevailing market atmosphere. Accordingly, we generally study the market for each proposed family of fragrance products for almost a full year before we introduce any new product into the market. This study is intended to define the general position of the fragrance family and more particularly its scent, bottle, packaging and appeal to the buyer. In our opinion, the unity of these four elements of the marketing mix makes for a successful product. As with any business, many aspects of our operations are subject to influences outside our control. We believe we have a strong brand portfolio with global reach and potential. As part of our strategy, we plan to continue to make investments in fast-growing markets and channels to grow market share. We discuss in greater detail risk factors relating to our business in I",https://www.sec.gov/Archives/edgar/data/822663/000175392626000464/ipar-20251231.htm,115
CMG,CHIPOTLE MEXICAN GRILL INC,Consumer Cyclical,Restaurants,90,SEC filing,10-K,2026-02-04,packaging,general_packaging_signal,25,"” “will,” “should,” “expect,” “intend,” “plan,” “anticipate,” “believe,” “estimate,” “seek,” “predict,” “could,” “project,” “potential”, “goal” and other similar terms and phrases, and include references to assumptions. Forward-looking statements in this report include statements about our anticipated comparable restaurant sales in 2026; the number of new restaurants we expect to open in 2026 and the number that will include a Chipotlane; the expected impact of tariffs on our food, beverage and packaging costs; our expectation to generate positive cash flow and that our cash from operations will be sufficient to meet ongoing capital expenditures, working capital requirements and other cash needs for the foreseeable future; our expected capital expenditures in 2026 for the construction of new restaurants, remodeling existing restaurants, new equipment and hardware, and technology; our ability to manage risks and pricing volatility in our supply chain; the ability of our supply chain to meet curr",https://www.sec.gov/Archives/edgar/data/1058090/000105809026000009/cmg-20251231.htm,115
BDL,FLANIGANS ENTERPRISES INC,Consumer Cyclical,Restaurants,90,SEC filing,10-Q,2026-05-12,packaging,general_packaging_signal,20,"ies. We cannot predict the timing or impact, if any, of such actions. Our operations and financial results will likely be adversely affected by increased commodity and energy volatility resulting from the ongoing conflict in the Middle East, specifically involving Iran. The escalation of hostilities has led to significant fluctuations in global oil and natural gas prices. Furthermore, if energy prices remain elevated, we may experience sustained inflationary pressure on key food commodities and packaging materials. 27 Legislative and Regulatory Risk On July 4, 2025, the One Big Beautiful Bill Act (Public Law No. 119-21) was signed into law. Among other provisions, the legislation includes certain tax incentives and regulatory changes applicable to businesses in the food service and hospitality industries. The legislation has multiple effective dates, with certain provisions implemented through 2027. We continue to review the legislation to determine its potential impact. Interest Rate Risk As p",https://www.sec.gov/Archives/edgar/data/12040/000117494726000581/bdl-20260328.htm,110
CVGW,CALAVO GROWERS INC,Consumer Defensive,Food Distribution,95,SEC filing,8-K,2026-04-20,packaging,general_packaging_signal,15,"ct new clients and retain existing clients; changes in client advertising, marketing, and corporate communications requirements; failure to manage potential conflicts of interest between or among clients of each company; the ability of our management team to work together successfully; the impact of weather on market conditions; seasonality of our business; sensitivity of our business to changes in market prices of avocados and other agricultural products and other raw materials including fuel, packaging and paper; changes or actions associated with USDA-APHIS and the Mexican Secretary of Agriculture, Secretariat of Agriculture and Rural Development (SADER) phytosanitary regulations (certification regulation for the importation of Hass avocados to the United States); potential disruptions to our supply chain; risks associated with potential future acquisitions, including integration; potential exposure to data breaches and other cyber-attacks on our systems or those of our suppliers or customer",https://www.sec.gov/Archives/edgar/data/1133470/000119312526162551/d102106d8k.htm,110
CVGW,CALAVO GROWERS INC,Consumer Defensive,Food Distribution,95,SEC filing,8-K,2026-04-29,packaging,general_packaging_signal,15,"ct new clients and retain existing clients; changes in client advertising, marketing, and corporate communications requirements; failure to manage potential conflicts of interest between or among clients of each company; the ability of our management team to work together successfully; the impact of weather on market conditions; seasonality of our business; sensitivity of our business to changes in market prices of avocados and other agricultural products and other raw materials including fuel, packaging and paper; changes or actions associated with USDA-APHIS and the Mexican Secretary of Agriculture, Secretariat of Agriculture and Rural Development (SADER) phytosanitary regulations (certification regulation for the importation of Hass avocados to the United States); potential disruptions to our supply chain; risks associated with potential future acquisitions, including integration; potential exposure to data breaches and other cyber-attacks on our systems or those of our suppliers or customer",https://www.sec.gov/Archives/edgar/data/1133470/000119312526189293/d134182d8k.htm,110
AVO,"Mission Produce, Inc.",Consumer Defensive,Food Distribution,95,SEC filing,8-K,2026-04-20,packaging,general_packaging_signal,15,"ct new clients and retain existing clients; changes in client advertising, marketing, and corporate communications requirements; failure to manage potential conflicts of interest between or among clients of each company; the ability of our management team to work together successfully; the impact of weather on market conditions; seasonality of our business; sensitivity of our business to changes in market prices of avocados and other agricultural products and other raw materials including fuel, packaging and paper; changes or actions associated with USDA-APHIS and the Mexican Secretary of Agriculture, Secretariat of Agriculture and Rural Development (SADER) phytosanitary regulations (certification regulation for the importation of Hass avocados to the United States); potential disruptions to our supply chain; risks associated with potential future acquisitions, including integration; potential exposure to data breaches and other cyber-attacks on our systems or those of our suppliers or customer",https://www.sec.gov/Archives/edgar/data/1802974/000119312526162671/d136701d8k.htm,110
CMG,CHIPOTLE MEXICAN GRILL INC,Consumer Cyclical,Restaurants,90,SEC filing,10-Q,2026-04-30,packaging,general_packaging_signal,20," notes to condensed consolidated financial statements. 1 Table of Contents CHIPOTLE MEXICAN GRILL, INC. CONDENSED CONSOLIDATED STATEMENTS OF INCOME AND COMPREHENSIVE INCOME (in thousands, except per share data) (unaudited) Three months ended March 31, 2026 2025 Food and beverage revenue $ 3,072,730 $ 2,859,831 Delivery service revenue 15,512 15,422 Total revenue 3,088,242 2,875,253 Restaurant operating costs (exclusive of depreciation and amortization shown separately below): Food, beverage and packaging 913,346 838,403 Labor 805,411 718,226 Occupancy 169,881 149,841 Other operating costs 480,643 415,161 General and administrative expenses 203,720 172,783 Depreciation and amortization 96,718 87,211 Pre-opening costs 11,641 8,210 Impairment, closure costs, and asset disposals 9,819 6,168 Total operating expenses 2,691,179 2,396,003 Income from operations 397,063 479,250 Interest and other income, net 8,742 22,253 Income before income taxes 405,805 501,503 Provision for income taxes 102,981 114,9",https://www.sec.gov/Archives/edgar/data/1058090/000105809026000028/cmg-20260331.htm,110
BRFH,BARFRESH FOOD GROUP INC.,Consumer Defensive,Beverages - Non-Alcoholic,90,SEC filing,10-Q,2026-05-14,packaging,general_packaging_signal,20,"er share as their effect is anti-dilutive as a result of losses incurred. Recent Pronouncements From time to time, new accounting pronouncements are issued that we adopt as of the specified effective date. We have not determined if the impact of recently issued standards that are not yet effective will have an impact on our results of operations and financial position. Note 2. Inventory Inventory consists of the following: Schedule of Inventory March 31, December 31, 2026 2025 Raw materials and packaging $ 957,000 $ 684,000 Finished goods 848,000 981,000 Inventory, net $ 1,805,000 $ 1,665,000 8 Note 3. Property Plant and Equipment Property and equipment, net consist of the following: Schedule of Property and Equipment March 31, December, 31 2026 2025 Land $ 357,000 $ 357,000 Building 1,834,000 1,834,000 Manufacturing equipment 2,559,000 2,335,000 Customer equipment 1,426,000 1,426,000 Construction in progress 5,051,000 5,139,000 Property and equipment, gross 11,227,000 11,091,000 Less: accumula",https://www.sec.gov/Archives/edgar/data/1487197/000149315226023106/form10-q.htm,110
FOSL,"Fossil Group, Inc.",Consumer Cyclical,Footwear & Accessories,90,SEC filing,10-Q,2026-05-14,packaging,general_packaging_signal,20,"s and an increase to customer liabilities and other current assets to the extent the returned product is resalable. Cost of Sales includes raw material costs, assembly labor, assembly overhead including depreciation expense, assembly warehousing costs and shipping and handling costs related to the movement of finished goods from assembly locations to sales distribution centers and from sales distribution centers to customer locations. Additionally, cost of sales includes customs duties, product packaging cost, royalty cost associated with sales of licensed products, the cost of molding and tooling, inventory shrinkage and damages and restructuring charges. Gross Profit and gross profit margin are influenced by our diversified business model that includes, but is not limited to: (i) product categories that we distribute; (ii) the multiple brands, including both owned and licensed, we offer within several product categories; (iii) the geographical presence of our businesses; and (iv) the differen",https://www.sec.gov/Archives/edgar/data/883569/000088356926000038/fosl-20260404.htm,110
CVGW,CALAVO GROWERS INC,Consumer Defensive,Food Distribution,95,SEC filing,8-K,2026-03-12,packaging,general_packaging_signal,15,"ct new clients and retain existing clients; changes in client advertising, marketing, and corporate communications requirements; failure to manage potential conflicts of interest between or among clients of each company; the ability of our management team to work together successfully; the impact of weather on market conditions; seasonality of our business; sensitivity of our business to changes in market prices of avocados and other agricultural products and other raw materials including fuel, packaging and paper; changes or actions associated with USDA-APHIS and the Mexican Secretary of Agriculture, Secretariat of Agriculture and Rural Development (SADER) phytosanitary regulations (certification regulation for the importation of Hass avocados to the United States); potential disruptions to our supply chain; risks associated with potential future acquisitions, including integration; potential exposure to data breaches and other cyber-attacks on our systems or those of our suppliers or customer",https://www.sec.gov/Archives/edgar/data/1133470/000110465926027161/cvgw-20260312x8k.htm,110
CVGW,CALAVO GROWERS INC,Consumer Defensive,Food Distribution,95,SEC filing,8-K,2026-04-17,packaging,general_packaging_signal,15,"ct new clients and retain existing clients; changes in client advertising, marketing, and corporate communications requirements; failure to manage potential conflicts of interest between or among clients of each company; the ability of our management team to work together successfully; the impact of weather on market conditions; seasonality of our business; sensitivity of our business to changes in market prices of avocados and other agricultural products and other raw materials including fuel, packaging and paper; changes or actions associated with USDA-APHIS and the Mexican Secretary of Agriculture, Secretariat of Agriculture and Rural Development (SADER) phytosanitary regulations (certification regulation for the importation of Hass avocados to the United States); potential disruptions to our supply chain; risks associated with potential future acquisitions, including integration; potential exposure to data breaches and other cyber-attacks on our systems or those of our suppliers or customer",https://www.sec.gov/Archives/edgar/data/1133470/000119312526161570/d16772d8k.htm,110
QSR,Restaurant Brands International Inc.,Consumer Cyclical,Restaurants,90,SEC filing,10-Q,2026-05-06,packaging,general_packaging_signal,20," $ 11 $ 138 $ 7 $ — $ 539 Additional segment information: Depreciation and amortization $ 27 $ 13 $ 3 $ 1 $ 7 $ 20 $ — $ 71 (Income) loss from equity method investments $ ( 3 ) $ — $ — $ — $ ( 2 ) $ — $ — $ ( 5 ) Capital expenditures $ 5 $ 5 $ 2 $ 1 $ 2 $ 16 $ — $ 31 13 Table of Contents The following table presents the components of Company restaurant expenses for our RH segment (in millions): Three Months Ended March 31, 2026 2025 Company restaurant expenses for RH segment Food, beverage, and packaging costs $ 133 $ 121 Restaurant wages and related expenses 146 145 Restaurant occupancy expense and other 122 113 Total $ 401 $ 379 The following tables present revenues by country (in millions): Three Months Ended March 31, 2026 2025 Revenues by country (c): United States $ 1,099 $ 1,073 Canada 902 815 Other 263 221 Total $ 2,264 $ 2,109 (c) Only the United States and Canada represented 10 % or more of our total revenues in each period presented. Our CODM manages assets on a consolidated basis. A",https://www.sec.gov/Archives/edgar/data/1618756/000161875626000029/qsr-20260331.htm,110
MCD,MCDONALDS CORP,Consumer Cyclical,Restaurants,90,SEC filing,10-Q,2025-11-05,packaging,general_packaging_signal,20,"l losses or all types of claims that may arise. LEGAL AND REGULATORY Increasing regulatory and legal complexity may adversely affect our business and financial results. Our regulatory and legal environment worldwide exposes us to complex compliance, litigation and similar risks that could affect our operations and results in material ways. Many of our markets are subject to increasing, conflicting and highly prescriptive regulations involving, among other matters, restaurant operations, product packaging, marketing, use of information technology systems, the nutritional and allergen content and safety of our food and other products, labeling and other disclosure practices. Compliance efforts with those regulations may be affected by ordinary variations in food preparation among our own restaurants and the need to rely on the accuracy and completeness of information from third-party suppliers. We also are subject to increasing public focus, including by governmental and non-governmental organiza",https://www.sec.gov/Archives/edgar/data/63908/000006390825000059/mcd-20250930.htm,110
LIMX,Limitless X Holdings Inc.,Consumer Defensive,Packaged Foods,85,SEC filing,10-K,2026-04-15,packaging,general_packaging_signal,25,"pricing strategy, and go to market planning. Particular emphasis is placed on regulatory readiness, including ingredient vetting, label accuracy, substantiation of product claims, and adherence to FDA, FTC, and applicable state guidelines. For athlete facing products, additional safeguards are implemented to ensure products are athlete safe, compliant with applicable sport’s governing body standards, and suitable for professional and high-performance use. We oversee product concept development, packaging design, and regulatory positioning to ensure each product is built for both direct to consumer performance and long-term retail scalability. Mr. Sanders’ prior experience developing products for distribution through major national retailers provides the Company with operational insight into retailer compliance requirements, margin structures, quality documentation, and onboarding processes. In addition, the Company facilitates key introductions to experienced partners across public relations, i",https://www.sec.gov/Archives/edgar/data/1803977/000149315226016760/form10-k.htm,110
